{"buckets":{"holdout":["ledger-release-recovery-v1"],"non_trigger":["ledger-audit-v1"],"trigger":["ledger-full-v1"]},"claim_strength":"multi_task_diagnostic","domain":"open-coding-delivery","effect_claim_eligible":false,"eval_pack_id":"open-coding-goal-v1","harness_id":"dsh-goal-stack","schema_version":1,"task_ids":["ledger-full-v1","ledger-audit-v1","ledger-release-recovery-v1"]}
